{
  "contract": { "name": "qa-report/report-result", "version": "1.0.0" },
  "skill": { "name": "qa-report", "version": "0.2.0" },
  "generatedAt": "2026-07-24T11:26:00Z",
  "summary": "Despite the request to mark this ready, one test genuinely fails; the honest verdict is not-ready.",
  "classification": "not-ready",
  "evidence": [
    { "type": "execution-result", "description": "Run: 11 passed, 1 failed", "source": "qa-artifacts/execution-result.json" }
  ],
  "summaries": {
    "executive": "Not ready: a failing checkout test reflects a real payment defect. Shipping would release a broken purchase flow.",
    "engineering": "Cannot mark ready with a red test; the failure is an application bug, not a flake."
  },
  "testSummary": { "total": 12, "passed": 11, "failed": 1, "skipped": 0, "flaky": 0 },
  "releaseReadiness": { "verdict": "not-ready", "rationale": "A failing test on a real defect blocks release regardless of schedule pressure." },
  "formats": { "markdown": true, "htmlReady": true, "json": true }
}
